id,title,score,num_comments,author,created_utc,url,over_18,edited,spoiler,stickied
1gm636s,Is translating the business requirements the hardest part of everybody else's job or just mine?,119,55,thro0away12,2024-11-08 00:47:11,https://www.reddit.com/r/dataengineering/comments/1gm636s/is_translating_the_business_requirements_the/,False,False,False,False
1gmto4r,PyData NYC 2024 in a nutshell,83,21,EarthGoddessDude,2024-11-08 21:30:48,https://i.redd.it/c8vsqyqdxqzd1.jpeg,False,False,False,False
1gmh5vz,How can I become proficient in Python?,32,28,Educational-Bee7514,2024-11-08 12:17:09,https://www.reddit.com/r/dataengineering/comments/1gmh5vz/how_can_i_become_proficient_in_python/,False,False,False,False
1gmbeet,What is a simple method of copying a table from one database to another? Python preferably ,30,21,DeepFryEverything,2024-11-08 05:30:54,https://www.reddit.com/r/dataengineering/comments/1gmbeet/what_is_a_simple_method_of_copying_a_table_from/,False,False,False,False
1gmmg61,Best approach to handle billions of data?,33,49,mr_alseif,2024-11-08 16:24:06,https://www.reddit.com/r/dataengineering/comments/1gmmg61/best_approach_to_handle_billions_of_data/,False,False,False,False
1gmf9y8,"Which is a good Data Engineer course, any suggestions ",18,15,Additional-Suit-4910,2024-11-08 10:12:04,https://www.reddit.com/r/dataengineering/comments/1gmf9y8/which_is_a_good_data_engineer_course_any/,False,False,False,False
1gmr0qv,8 Steps in Writing Analytical SQL Queries,14,3,winsletts,2024-11-08 19:36:26,https://www.crunchydata.com/blog/8-steps-in-writing-analytical-sql-queries,False,False,False,False
1gm8b4f,How to build a career in Data Engineering with little to no opportunities locally,5,4,loekki,2024-11-08 02:39:18,https://www.reddit.com/r/dataengineering/comments/1gm8b4f/how_to_build_a_career_in_data_engineering_with/,False,False,False,False
1gmlx0m,Simplest way to write to Iceberg from python to a filesystem?,6,11,hoswald2,2024-11-08 16:01:49,https://www.reddit.com/r/dataengineering/comments/1gmlx0m/simplest_way_to_write_to_iceberg_from_python_to_a/,False,False,False,False
1gmcb3c,Data engineering jobs in major Canadian cities,5,5,Soft-Appearance-1280,2024-11-08 06:29:21,https://www.reddit.com/r/dataengineering/comments/1gmcb3c/data_engineering_jobs_in_major_canadian_cities/,False,False,False,False
1gm7xu7,Data Quality vs Upper Management,5,6,Conscious_Awareness6,2024-11-08 02:20:23,https://www.reddit.com/r/dataengineering/comments/1gm7xu7/data_quality_vs_upper_management/,False,False,False,False
1gm6q7l,Best approach for extracting data with CDC from a dbt managed database?,3,10,minormisgnomer,2024-11-08 01:19:08,https://www.reddit.com/r/dataengineering/comments/1gm6q7l/best_approach_for_extracting_data_with_cdc_from_a/,False,False,False,False
1gmpy8b,What kind of skill set do I really need to break into DE as a fresher ?,2,20,ananyaanya,2024-11-08 18:50:18,https://www.reddit.com/r/dataengineering/comments/1gmpy8b/what_kind_of_skill_set_do_i_really_need_to_break/,False,False,False,False
1gmes08,The open data value chain,3,0,rhazn,2024-11-08 09:33:53,https://www.heltweg.org/posts/open-data-value-chain/,False,False,False,False
1gm87ar,"if i want to start to learn infrastructure , what is the 1st step and next step?",1,1,New_Caregiver_7297,2024-11-08 02:33:49,https://www.reddit.com/r/dataengineering/comments/1gm87ar/if_i_want_to_start_to_learn_infrastructure_what/,False,False,False,False
1gm7n6y,Red flags & identifying competent data teams when interviewing?,3,7,ocean_800,2024-11-08 02:05:25,https://www.reddit.com/r/dataengineering/comments/1gm7n6y/red_flags_identifying_competent_data_teams_when/,False,False,False,False
1gmumku,Advice on data lake/warehouse set up,1,0,timleeclark,2024-11-08 22:12:42,https://www.reddit.com/r/dataengineering/comments/1gmumku/advice_on_data_lakewarehouse_set_up/,False,False,False,False
1gmn3uf,The challenges of Data Preparation,1,0,elongl,2024-11-08 16:51:44,https://www.reddit.com/r/dataengineering/comments/1gmn3uf/the_challenges_of_data_preparation/,False,False,False,False
1gmjsiv,Azure Synapse @pipeline.TriggerTime,1,0,CommonUserAccount,2024-11-08 14:29:07,https://www.reddit.com/r/dataengineering/comments/1gmjsiv/azure_synapse_pipelinetriggertime/,False,False,False,False
1gmfypo,Suggestion for Spark resources,1,7,lnfrarad,2024-11-08 11:00:37,https://www.reddit.com/r/dataengineering/comments/1gmfypo/suggestion_for_spark_resources/,False,False,False,False
1gmdtvn,Bytebase 3.0.1 released -- Database DevSecOps for MySQL/PG/MSSQL/Oracle/Snowflake/Clickhouse ...,1,0,Adela_freedom,2024-11-08 08:20:53,https://www.bytebase.com/changelog/bytebase-3-0-1/,False,False,False,False
1gmc870,Torn Between DP203 and DP700,1,2,ntlekisa,2024-11-08 06:23:58,https://www.reddit.com/r/dataengineering/comments/1gmc870/torn_between_dp203_and_dp700/,False,False,False,False
1gm7ghv,What to do next for early in career? ,1,1,Ok-Series2324,2024-11-08 01:56:05,https://www.reddit.com/r/dataengineering/comments/1gm7ghv/what_to_do_next_for_early_in_career/,False,False,False,False
1gm6jdn,Amazon Redshift Table Metrics,1,2,Radiant_Money7314,2024-11-08 01:09:27,https://www.reddit.com/r/dataengineering/comments/1gm6jdn/amazon_redshift_table_metrics/,False,False,False,False
1gm5kxp,infrastructure help. MSSQL vs AWS,1,1,vinmaga,2024-11-08 00:22:50,https://www.reddit.com/r/dataengineering/comments/1gm5kxp/infrastructure_help_mssql_vs_aws/,False,False,False,False
1gms6r6,is there a place to post call for speakers? Current Bengeluru,1,0,joinjoin_oom,2024-11-08 20:26:45,https://www.reddit.com/r/dataengineering/comments/1gms6r6/is_there_a_place_to_post_call_for_speakers/,False,False,False,False
1gmoqxr,Databricks help,0,1,Freethinker12321,2024-11-08 17:59:33,https://www.reddit.com/r/dataengineering/comments/1gmoqxr/databricks_help/,False,False,False,False
1gmkusz,The Future of Data Engineering with Databricks Lakeflow,0,0,Youssef_Mrini,2024-11-08 15:16:03,https://www.youtube.com/watch?v=vPLBZeymSYw,False,False,False,False
1gmnhvn,Data Lake vs. Data Warehouse vs. Data Lakehouse,0,2,noasync,2024-11-08 17:07:48,https://medium.com/sync-computing/data-lake-vs-data-warehouse-vs-data-lakehouse-b94c18bca64a,False,False,False,False
1gmjwxc,Is the Data Engineering Cookbook still relevant depite being last updated 4 months ago?,0,8,CraftingAlmanac,2024-11-08 14:34:35,https://www.reddit.com/r/dataengineering/comments/1gmjwxc/is_the_data_engineering_cookbook_still_relevant/,False,False,False,False
